{
  "id": "perimenopause",
  "term": "perimenopause",
  "definition": "Perimenopause is a stage in a woman’s life linked with physical and hormonal changes. In mental health, it is noted because these changes can trigger a depressive episode in some women.",
  "field": "mental health",
  "also_see": [],
  "aliases": [],
  "sources": [
    "nimh-page-8ec919dca10c05f7"
  ],
  "provenance": [
    {
      "role": "draft_basis",
      "source": "nimh-page-8ec919dca10c05f7",
      "revision": "HTML publication snapshot 2026-10-18; SHA-256 d7e3878cd110511a1cab8edfc2803470cfecef390d776a8858330f68a78c0fab",
      "scope": "Source record https://www.nimh.nih.gov/health/publications/depression-in-women; pinned source text",
      "locator": "https://www.nimh.nih.gov/health/publications/depression-in-women"
    }
  ],
  "version": 1,
  "packet_hash": "4550ad256f2f8695f02ad0d4c4852d6342ef8f4188d6ec12e76ad349380a4519",
  "draft_evidence": {
    "model": "gpt-5.4-2026-03-05",
    "receipt_id": "f4218bc56f454c828888b49f3f792c72",
    "request_hash": "86fdb316bbfa2a96379ae766e56ff628a56409c8e8ac4762e0a7c5a753154480",
    "registration_hash": "4ed013ab52ed87515f6842cbec110fef45588e8fcada34dbb420e9458ebcf230",
    "definition_hash": "e3d528d15a4b9a4dce944fc1048f5b69920bb1b10cebef2f9879e0d0aa0da02d",
    "packet_hash": "4550ad256f2f8695f02ad0d4c4852d6342ef8f4188d6ec12e76ad349380a4519"
  },
  "hash": "34617aca1f6240333cd07d604a9cfccc9b87763a82d6f3ca2d4e98286f0f5531",
  "reader_reviews": [
    {
      "model": "gpt-5.4-nano-2026-03-17",
      "draft_model": "gpt-5.4-2026-03-05",
      "passed": true,
      "reasons": [],
      "definition_hash": "e3d528d15a4b9a4dce944fc1048f5b69920bb1b10cebef2f9879e0d0aa0da02d",
      "packet_hash": "4550ad256f2f8695f02ad0d4c4852d6342ef8f4188d6ec12e76ad349380a4519",
      "published_packet_hash": "4550ad256f2f8695f02ad0d4c4852d6342ef8f4188d6ec12e76ad349380a4519",
      "receipt_id": "7d5bb3bbb5764748b2055c798a7f25ee",
      "request_hash": "c5d6587298b5fd550c3f832db695e95b60ec1e111496d4e4696e6f20407e0aa6",
      "registration_hash": "6e360761531d7665c7ad2525ebc2708a3d8f7362e3388c6161407596fd641c01"
    },
    {
      "model": "gpt-5.4-mini-2026-03-17",
      "draft_model": "gpt-5.4-2026-03-05",
      "passed": true,
      "reasons": [],
      "definition_hash": "e3d528d15a4b9a4dce944fc1048f5b69920bb1b10cebef2f9879e0d0aa0da02d",
      "packet_hash": "4550ad256f2f8695f02ad0d4c4852d6342ef8f4188d6ec12e76ad349380a4519",
      "published_packet_hash": "4550ad256f2f8695f02ad0d4c4852d6342ef8f4188d6ec12e76ad349380a4519",
      "receipt_id": "cdead056f0524c3ea10dd8ac6453781d",
      "request_hash": "7ce64577c7c2b5624385f262e17dcd2fd3e13132809ee33ff7f761369aea4190",
      "registration_hash": "6e360761531d7665c7ad2525ebc2708a3d8f7362e3388c6161407596fd641c01"
    }
  ]
}
