{
  "id": "self-abasement",
  "term": "self-abasement",
  "definition": "Self-abasement is a marked lowering or humbling of one’s sense of self-worth. In this source, it refers to the strong self-depreciation seen in shame, involving self-condemnation or a feeling of ill-desert rather than mere social hesitation.",
  "field": "history",
  "also_see": [],
  "aliases": [],
  "sources": [
    "baldwin-1902-v2"
  ],
  "provenance": [
    {
      "role": "draft_basis",
      "source": "baldwin-1902-v2",
      "revision": "1902 original US edition; OCR SHA-256 b86b5dbbaa0a0b3ecf6c8b0a089a7ca5409b9bac4e6481cba91c99bba16f31bd",
      "scope": "Source record philopsych02balduoft:chars-2971500-2983500; pinned source text",
      "locator": "https://archive.org/download/philopsych02balduoft/philopsych02balduoft_djvu.txt"
    }
  ],
  "version": 1,
  "packet_hash": "26c9b28d04e3586feaab4f52c7c316275825f806a4413eca01d3d9720fe1d8a7",
  "draft_evidence": {
    "model": "gpt-5.4-2026-03-05",
    "receipt_id": "383f64f3c60e424c9993d603e651d529",
    "request_hash": "39dfaabf482c54a6e4d9c486dca96119f970c410ec415227d11a3763669a03b2",
    "registration_hash": "ccf30c2b50e89ba708861f3f1f3da783e9b04d822e3a8e481728b41b9421bcc1",
    "definition_hash": "7f2f0cdd77df2206984d298c1454891f7d3651b89aabb8015c1887dc1a7397d2",
    "packet_hash": "26c9b28d04e3586feaab4f52c7c316275825f806a4413eca01d3d9720fe1d8a7"
  },
  "hash": "c4530a85faf4080a88339a52fc7247bf05438b87d9ef820c944ec728322f8132",
  "reader_reviews": [
    {
      "model": "gpt-5.4-mini-2026-03-17",
      "draft_model": "gpt-5.4-2026-03-05",
      "passed": true,
      "reasons": [],
      "definition_hash": "7f2f0cdd77df2206984d298c1454891f7d3651b89aabb8015c1887dc1a7397d2",
      "packet_hash": "26c9b28d04e3586feaab4f52c7c316275825f806a4413eca01d3d9720fe1d8a7",
      "published_packet_hash": "26c9b28d04e3586feaab4f52c7c316275825f806a4413eca01d3d9720fe1d8a7",
      "receipt_id": "830ac4eebff648d0913d12bf54768bc6",
      "request_hash": "1c1fe4084f94d532543dec71bb5a2daef27b8d95fc146b9d8280f65f6d4bb87e",
      "registration_hash": "7e82aff66f337c6fe5d7ddbbe9cb4c76ece07a01379e2e612f5d8f6ea3b4e7f8"
    },
    {
      "model": "gpt-5.4-nano-2026-03-17",
      "draft_model": "gpt-5.4-2026-03-05",
      "passed": false,
      "reasons": [
        "The packet does not explicitly define *self-abasement* as a “marked lowering or humbling of one’s sense of self-worth”; it instead describes shame as involving “positive and strong self-abasement” and “lowered self-esteem.”",
        "The definition’s phrasing “strong self-depreciation” is not directly stated in the packet; the packet uses “self-abasement,” “lowered self-esteem,” “self-condemnation,” and “ill-desert.”",
        "Because the key descriptive wording (“marked lowering or humbling,” “self-depreciation”) is not supported verbatim or equivalently by the packet, the definition contains unsupported generalization about the meaning of the term."
      ],
      "definition_hash": "7f2f0cdd77df2206984d298c1454891f7d3651b89aabb8015c1887dc1a7397d2",
      "packet_hash": "26c9b28d04e3586feaab4f52c7c316275825f806a4413eca01d3d9720fe1d8a7",
      "published_packet_hash": "26c9b28d04e3586feaab4f52c7c316275825f806a4413eca01d3d9720fe1d8a7",
      "receipt_id": "d5b25a43b49d43bbac9c1ac4478b27d2",
      "request_hash": "26f842af759bd5f4822cb114f3e3331ff8ed7dd77908f6cfe574cc26a43daa9b",
      "registration_hash": "7e82aff66f337c6fe5d7ddbbe9cb4c76ece07a01379e2e612f5d8f6ea3b4e7f8"
    }
  ],
  "external_review": {
    "batch": "claude-tiebreak-2026-10-18",
    "manifest_sha256": "1895b37c6cfc8bcc92612215f67cee23e8b8875d822d42063922d62a8b57dd58"
  }
}
