{
  "id": "eyewitness-testimony",
  "term": "eyewitness testimony",
  "definition": "Eyewitness testimony is evidence given by a person about what they remember of a crime or other event they saw. In psychology, it is understood as memory-based evidence that can be important in court but may be affected by internal and external influences, raising questions about its reliability.",
  "field": "cognition",
  "also_see": [],
  "aliases": [],
  "sources": [
    "article-pmc11189012"
  ],
  "provenance": [
    {
      "role": "draft_basis",
      "source": "article-pmc11189012",
      "revision": "2024; DOI 10.3389/fpsyg.2024.1406897; article XML SHA-256 c71fd7609b3bdc2e557f2f07a01e3d61ea3ef78e7392b5d5ede8ea037878eca9",
      "scope": "Source record 10.3389/fpsyg.2024.1406897; pinned source text",
      "locator": "https://doi.org/10.3389/fpsyg.2024.1406897"
    }
  ],
  "version": 1,
  "packet_hash": "41166250cdf62ba29f8049b056c62f6f87f8d7b83b28a2ce06accb772abc9fa7",
  "draft_evidence": {
    "model": "gpt-5.4-2026-03-05",
    "receipt_id": "5693f532c8584b3c9bfe967717fc3817",
    "request_hash": "577ef8e9fbf68e9aab02902cfc44766d78c284703e77be6068ff108859d138cc",
    "registration_hash": "5c490b681daeaf182d38c4329d8d3eef885f9a2af23c9be8197c6f7a3cc13c21",
    "definition_hash": "713a58d5cde2a5183ea318e3b1b355e5b48b94556ac6747bcf83d249c2b8ed45",
    "packet_hash": "41166250cdf62ba29f8049b056c62f6f87f8d7b83b28a2ce06accb772abc9fa7"
  },
  "hash": "42b59c78c182167e0fddeea07ddd912ac7fa32a478f02e887d335ee90d490689",
  "reader_reviews": [
    {
      "model": "gpt-5.4-mini-2026-03-17",
      "draft_model": "gpt-5.4-2026-03-05",
      "passed": true,
      "reasons": [],
      "definition_hash": "713a58d5cde2a5183ea318e3b1b355e5b48b94556ac6747bcf83d249c2b8ed45",
      "packet_hash": "41166250cdf62ba29f8049b056c62f6f87f8d7b83b28a2ce06accb772abc9fa7",
      "published_packet_hash": "41166250cdf62ba29f8049b056c62f6f87f8d7b83b28a2ce06accb772abc9fa7",
      "receipt_id": "72a86a61360541e69a28ee90e5bccbec",
      "request_hash": "7c1d76fce412273a1aded142042f3a5b849d9a05fd2173d1e909316e77b06a6b",
      "registration_hash": "a313e407e9d8a9a0eaa57511447e185aa14baf5f838272b8f2d3aa07d9c4dc6e"
    },
    {
      "model": "gpt-5.4-nano-2026-03-17",
      "draft_model": "gpt-5.4-2026-03-05",
      "passed": false,
      "reasons": [
        "The definition states eyewitness testimony concerns “a crime or other event,” but the packet only discusses testimony regarding “a crime” and “events of a crime,” not other types of events.",
        "The definition says it “may be affected by internal and external influences, raising questions about its reliability,” which is directionally supported, but the specific framing about court/jury treatment in the definition is broader than what the packet explicitly states (the packet mentions “court proceedings” and comparison to “biochemical traces,” but not “court but … may be affected” as a combined formulation with court/jury specifics)."
      ],
      "definition_hash": "713a58d5cde2a5183ea318e3b1b355e5b48b94556ac6747bcf83d249c2b8ed45",
      "packet_hash": "41166250cdf62ba29f8049b056c62f6f87f8d7b83b28a2ce06accb772abc9fa7",
      "published_packet_hash": "41166250cdf62ba29f8049b056c62f6f87f8d7b83b28a2ce06accb772abc9fa7",
      "receipt_id": "a61fbf95e5b547918e313d44ba16fb1f",
      "request_hash": "c57dfe02ecdae36f3e076a08c978385b1c00fec3b0fc13a2ae14a49fbd66c466",
      "registration_hash": "a313e407e9d8a9a0eaa57511447e185aa14baf5f838272b8f2d3aa07d9c4dc6e"
    }
  ]
}
