{
  "id": "normative-ethics",
  "term": "normative ethics",
  "definition": "Normative ethics is a coherent moral theory that sets out general standards for judging and guiding right and wrong conduct. It aims to provide broad principles for evaluating how people ought to act.",
  "field": "ethics",
  "also_see": [],
  "aliases": [],
  "sources": [
    "mesh-2026"
  ],
  "provenance": [
    {
      "role": "draft_basis",
      "source": "mesh-2026",
      "revision": "2026 descriptor edition",
      "scope": "Source record D028663; pinned source text",
      "locator": "https://meshb.nlm.nih.gov/record/ui?ui=D028663"
    }
  ],
  "version": 1,
  "packet_hash": "ab7e0d4f4d8ccbe6e4a46a546151217117c7cde90c81253ca9649b657534106f",
  "draft_evidence": {
    "model": "gpt-5.4-2026-03-05",
    "receipt_id": "4b8a219ceaab49088cc3b262c9794809",
    "request_hash": "904892d7beb931fe9a84d0982f3da9fdb3f71c1308e9189193c8f25b1f605619",
    "registration_hash": "ccf30c2b50e89ba708861f3f1f3da783e9b04d822e3a8e481728b41b9421bcc1",
    "definition_hash": "931a5e2e740edc9770901484617f4578e26cd91962fe9120de971994947750f2",
    "packet_hash": "ab7e0d4f4d8ccbe6e4a46a546151217117c7cde90c81253ca9649b657534106f"
  },
  "hash": "0fff96e27ff0fa7f623c0e85157a54cff6ff9b6f79936734f1c15fdd3ebd4c5c",
  "reader_reviews": [
    {
      "model": "gpt-5.4-mini-2026-03-17",
      "draft_model": "gpt-5.4-2026-03-05",
      "passed": true,
      "reasons": [],
      "definition_hash": "931a5e2e740edc9770901484617f4578e26cd91962fe9120de971994947750f2",
      "packet_hash": "ab7e0d4f4d8ccbe6e4a46a546151217117c7cde90c81253ca9649b657534106f",
      "published_packet_hash": "ab7e0d4f4d8ccbe6e4a46a546151217117c7cde90c81253ca9649b657534106f",
      "receipt_id": "48645af1207e4b029f01416be1922d03",
      "request_hash": "522534c392544f162493dacac008c9f4b914e491d1a991780cc1e57dfa81968a",
      "registration_hash": "7e82aff66f337c6fe5d7ddbbe9cb4c76ece07a01379e2e612f5d8f6ea3b4e7f8"
    },
    {
      "model": "gpt-5.4-nano-2026-03-17",
      "draft_model": "gpt-5.4-2026-03-05",
      "passed": true,
      "reasons": [],
      "definition_hash": "931a5e2e740edc9770901484617f4578e26cd91962fe9120de971994947750f2",
      "packet_hash": "ab7e0d4f4d8ccbe6e4a46a546151217117c7cde90c81253ca9649b657534106f",
      "published_packet_hash": "ab7e0d4f4d8ccbe6e4a46a546151217117c7cde90c81253ca9649b657534106f",
      "receipt_id": "c71fe0a38f4449f0841e05eab00d77a6",
      "request_hash": "5670b93f52f2be0b012cb8bbe25697029d7a4a836fe321b1bcfeb9d3523e6a8d",
      "registration_hash": "7e82aff66f337c6fe5d7ddbbe9cb4c76ece07a01379e2e612f5d8f6ea3b4e7f8"
    }
  ]
}
