{
  "id": "methysergide",
  "term": "methysergide",
  "definition": "Methysergide is an ergot-derived drug related to lysergic acid diethylamide that blocks serotonin’s effects in blood vessels and gastrointestinal smooth muscle. It has been used to help prevent migraine and other vascular headaches and to counter serotonin effects in carcinoid syndrome.",
  "field": "biological",
  "also_see": [],
  "aliases": [],
  "sources": [
    "mesh-2026"
  ],
  "provenance": [
    {
      "role": "draft_basis",
      "source": "mesh-2026",
      "revision": "2026 descriptor edition",
      "scope": "Source record D008784; pinned source text",
      "locator": "https://meshb.nlm.nih.gov/record/ui?ui=D008784"
    }
  ],
  "version": 1,
  "packet_hash": "22e46427db73f84f6e5e49cb58ee393e20210f1f262ece87974c502fac7bb2a9",
  "draft_evidence": {
    "model": "gpt-5.4-2026-03-05",
    "receipt_id": "3bccdf6414d24349817a903c7e5ffb44",
    "request_hash": "fd96ca761a22141e1133b5f9dcc9aa05746765f58ae458b7c5374119e85b4009",
    "registration_hash": "ccf30c2b50e89ba708861f3f1f3da783e9b04d822e3a8e481728b41b9421bcc1",
    "definition_hash": "2e92ef1f61d526df183ce37b5b6ef9d0e7fedf62dd229032b207f0bee693e6e3",
    "packet_hash": "22e46427db73f84f6e5e49cb58ee393e20210f1f262ece87974c502fac7bb2a9"
  },
  "hash": "651dd355dd3c423a0061d44c5c505dec55df21b13aa671712b13531c5f8c577b",
  "reader_reviews": [
    {
      "model": "gpt-5.4-mini-2026-03-17",
      "draft_model": "gpt-5.4-2026-03-05",
      "passed": true,
      "reasons": [],
      "definition_hash": "2e92ef1f61d526df183ce37b5b6ef9d0e7fedf62dd229032b207f0bee693e6e3",
      "packet_hash": "22e46427db73f84f6e5e49cb58ee393e20210f1f262ece87974c502fac7bb2a9",
      "published_packet_hash": "22e46427db73f84f6e5e49cb58ee393e20210f1f262ece87974c502fac7bb2a9",
      "receipt_id": "9a43563555214bcea79cf45002a2db8b",
      "request_hash": "9dd0c0f998eff2ab5d3eb284bcae5b0ad0dd520bd716242fb95292fc55978479",
      "registration_hash": "7e82aff66f337c6fe5d7ddbbe9cb4c76ece07a01379e2e612f5d8f6ea3b4e7f8"
    },
    {
      "model": "gpt-5.4-nano-2026-03-17",
      "draft_model": "gpt-5.4-2026-03-05",
      "passed": true,
      "reasons": [],
      "definition_hash": "2e92ef1f61d526df183ce37b5b6ef9d0e7fedf62dd229032b207f0bee693e6e3",
      "packet_hash": "22e46427db73f84f6e5e49cb58ee393e20210f1f262ece87974c502fac7bb2a9",
      "published_packet_hash": "22e46427db73f84f6e5e49cb58ee393e20210f1f262ece87974c502fac7bb2a9",
      "receipt_id": "1ef7f4b20c364f4789c5c73e52d7226d",
      "request_hash": "b9af0243af77c2b8e5c390ae625584669d1e63e8c0a3a4a857dd1f80ad3ba15d",
      "registration_hash": "7e82aff66f337c6fe5d7ddbbe9cb4c76ece07a01379e2e612f5d8f6ea3b4e7f8"
    }
  ]
}
