{
  "id": "habit-strength",
  "term": "habit strength",
  "definition": "Habit strength is the degree to which a consumption behavior is established as a habit, often reflected in how frequently a person does it. In this context, stronger habit strength was treated as an important source of differences in current consumption and in how people respond to warning labels.",
  "field": "learning",
  "also_see": [],
  "aliases": [],
  "sources": [
    "article-pmc11671022"
  ],
  "provenance": [
    {
      "role": "draft_basis",
      "source": "article-pmc11671022",
      "revision": "2024; DOI 10.1371/journal.pone.0316189; article XML SHA-256 68244692cb062c2c1c2b37e5dac7994cfca3ae5f2c104f11d187a693496cd688",
      "scope": "Source record 10.1371/journal.pone.0316189; pinned source text",
      "locator": "https://doi.org/10.1371/journal.pone.0316189"
    }
  ],
  "version": 1,
  "packet_hash": "88dad8c9acded1d9976494b870a0e654022499d35c78fb59e07f551a772969b7",
  "draft_evidence": {
    "model": "gpt-5.4-2026-03-05",
    "receipt_id": "3054f1ddffab4147a993adfa5819ed0a",
    "request_hash": "c7c4ec6c7a29673d69dae798f84ef7b4443d2e88dc08f9ad41e96bf7ba99b096",
    "registration_hash": "25368579361d58e6222ea9fd97f439d07e8021fa05268186ba46f7455945363b",
    "definition_hash": "33dad9246632adbfaca203a3be604cca3f9ee2a8929c487255d71c70f3484a84",
    "packet_hash": "88dad8c9acded1d9976494b870a0e654022499d35c78fb59e07f551a772969b7"
  },
  "hash": "35147bbc6e6dd5d1447afa1619aa173ecbee7c5710d142a917893a9e1275e4f5",
  "reader_reviews": [
    {
      "model": "gpt-5.4-nano-2026-03-17",
      "draft_model": "gpt-5.4-2026-03-05",
      "passed": false,
      "reasons": [
        "The packet supports that habit strength is related to consumers’ consumption frequency and current consumption, but it does not explicitly define habit strength as “the degree to which a consumption behavior is established as a habit.”"
      ],
      "definition_hash": "33dad9246632adbfaca203a3be604cca3f9ee2a8929c487255d71c70f3484a84",
      "packet_hash": "88dad8c9acded1d9976494b870a0e654022499d35c78fb59e07f551a772969b7",
      "published_packet_hash": "88dad8c9acded1d9976494b870a0e654022499d35c78fb59e07f551a772969b7",
      "receipt_id": "c24bb25bbbcb4a20bb29b783d4f37e48",
      "request_hash": "9431e5a4d7b049e959816216908a4b09fd16e43a63b78a9eca610544b47adb8e",
      "registration_hash": "c968292abafeb221c26c2c8587f8656c6ff7721637119e66edb873f458453d10"
    },
    {
      "model": "gpt-5.4-mini-2026-03-17",
      "draft_model": "gpt-5.4-2026-03-05",
      "passed": true,
      "reasons": [],
      "definition_hash": "33dad9246632adbfaca203a3be604cca3f9ee2a8929c487255d71c70f3484a84",
      "packet_hash": "88dad8c9acded1d9976494b870a0e654022499d35c78fb59e07f551a772969b7",
      "published_packet_hash": "88dad8c9acded1d9976494b870a0e654022499d35c78fb59e07f551a772969b7",
      "receipt_id": "17883b99d5f94c05a8b4fb1ab969856c",
      "request_hash": "fc289b65e624e982659cc1e9c438add565f09a89b190a2e77d9c4aad16940d68",
      "registration_hash": "c968292abafeb221c26c2c8587f8656c6ff7721637119e66edb873f458453d10"
    }
  ],
  "external_review": {
    "batch": "claude-tiebreak-2026-10-18",
    "manifest_sha256": "1895b37c6cfc8bcc92612215f67cee23e8b8875d822d42063922d62a8b57dd58"
  }
}
