{
  "id": "epileptogenic-lesion",
  "term": "epileptogenic lesion",
  "definition": "An epileptogenic lesion is a focal brain abnormality associated with a person’s epilepsy. In this context, it serves as a reference point for examining how language functions are organized in the brain before and after epilepsy surgery.",
  "field": "cognition",
  "also_see": [],
  "aliases": [],
  "sources": [
    "article-pmc7478845"
  ],
  "provenance": [
    {
      "role": "draft_basis",
      "source": "article-pmc7478845",
      "revision": "2020; DOI 10.1371/journal.pone.0238389; article XML SHA-256 ae359cacc0a67036b20e73ddbbfd1b3ca0b0ba28e2a27f4016afc1ce10285e2b",
      "scope": "Source record 10.1371/journal.pone.0238389; pinned source text",
      "locator": "https://doi.org/10.1371/journal.pone.0238389"
    }
  ],
  "version": 1,
  "packet_hash": "167f7410e1059cf026060521e48cd5ad7c60904bbd686e09820f59d1f360e558",
  "draft_evidence": {
    "model": "gpt-5.4-2026-03-05",
    "receipt_id": "55b72300cde841ecbe00275771ffa97a",
    "request_hash": "7b37b4837b830f0b7d9aebd92238bdca7090fee1b15e212f0db097cc045ea9ef",
    "registration_hash": "c055b22820bdafdcd43b9adda6b32a1870552428cbf2bc72128e227ba2b51e7d",
    "definition_hash": "1c9eca89c49ef3526ca7dab9bdcada590a2a5d00f8ec04cf8acb248873e9e38b",
    "packet_hash": "167f7410e1059cf026060521e48cd5ad7c60904bbd686e09820f59d1f360e558"
  },
  "hash": "e334408301749b823be2029553081f515405779a09c33be80509c8acecab6936",
  "reader_reviews": [
    {
      "model": "gpt-5.4-nano-2026-03-17",
      "draft_model": "gpt-5.4-2026-03-05",
      "passed": false,
      "reasons": [
        "The packet does not provide an explicit definition that an “epileptogenic lesion” is “a focal brain abnormality.” It only uses the term in the context of “focal lesional epilepsy” and analyzes language activations “with the epileptogenic lesion,” without stating the term’s meaning as a focal brain abnormality.",
        "While the packet does support using the epileptogenic lesion as a reference point in analyses of “language representation” and language changes in relation to surgery (preoperative vs postoperative language fMRI/lateralization), the first substantive claim about the term’s definition is not supported by the provided text."
      ],
      "definition_hash": "1c9eca89c49ef3526ca7dab9bdcada590a2a5d00f8ec04cf8acb248873e9e38b",
      "packet_hash": "167f7410e1059cf026060521e48cd5ad7c60904bbd686e09820f59d1f360e558",
      "published_packet_hash": "167f7410e1059cf026060521e48cd5ad7c60904bbd686e09820f59d1f360e558",
      "receipt_id": "4406b307491440329813732d740e73e9",
      "request_hash": "fe633b3046ad5d08f33f5dfce126caac7c539a6f259279e74c56eafe06a29947",
      "registration_hash": "02c5b7669e5933cb4530795e4a4d9d17d7d2190b202c7267fdd7502eaad524c4"
    },
    {
      "model": "gpt-5.4-mini-2026-03-17",
      "draft_model": "gpt-5.4-2026-03-05",
      "passed": false,
      "reasons": [
        "The packet does not define the term as a general concept; it uses ‘epileptogenic lesion’ only in the context of one study on children and young adults with focal lesional epilepsy.",
        "The second sentence adds a study-specific role (‘reference point for examining how language functions are organized… before and after epilepsy surgery’) that is not a supported dictionary sense of the term.",
        "The definition makes a broader causal claim about a ‘focal brain abnormality associated with a person’s epilepsy’ that is only indirectly suggested by the packet and not explicitly defined there."
      ],
      "definition_hash": "1c9eca89c49ef3526ca7dab9bdcada590a2a5d00f8ec04cf8acb248873e9e38b",
      "packet_hash": "167f7410e1059cf026060521e48cd5ad7c60904bbd686e09820f59d1f360e558",
      "published_packet_hash": "167f7410e1059cf026060521e48cd5ad7c60904bbd686e09820f59d1f360e558",
      "receipt_id": "88694e33a1a548a5abcc7cc0f36d68b2",
      "request_hash": "b67b5bdb380818e4f1d7a1ef623d75322360a9be906276579e01fa8e2776d6c9",
      "registration_hash": "02c5b7669e5933cb4530795e4a4d9d17d7d2190b202c7267fdd7502eaad524c4"
    }
  ]
}
