{
  "id": "dental",
  "term": "dental",
  "definition": "Dental refers to oral health care, including services delivered by dental care professionals. In this context, it describes care, education, and communication related to oral health.",
  "field": "development",
  "also_see": [],
  "aliases": [],
  "sources": [
    "article-pmc13618885"
  ],
  "provenance": [
    {
      "role": "draft_basis",
      "source": "article-pmc13618885",
      "revision": "2026; DOI 10.1371/journal.pone.0359436; article XML SHA-256 1b82bf8ffbed2fca15e1231c2068e8a6ba9ba956fc85fa02f672cf0b753d4b41",
      "scope": "Source record 10.1371/journal.pone.0359436; pinned source text",
      "locator": "https://doi.org/10.1371/journal.pone.0359436"
    }
  ],
  "version": 1,
  "packet_hash": "e799a38f74cad7cc3e6f83905eae0b99bfcc43f72a5feb5156bea1858c5148da",
  "draft_evidence": {
    "model": "gpt-5.4-2026-03-05",
    "receipt_id": "e55c2f750d9d48b9b1b007acefda9610",
    "request_hash": "80a99312ddc938958308d97f757dc298611fcaf769957261c1a3319d395c991f",
    "registration_hash": "c57989f3fbb5d448687075c46c328c2495dfc9d8fed88acfa5c6b0d69a91e974",
    "definition_hash": "0e6efc1ea50a46bd8071c9d6ae55e2075f3567905df2bd8d807c0b82c5c66821",
    "packet_hash": "e799a38f74cad7cc3e6f83905eae0b99bfcc43f72a5feb5156bea1858c5148da"
  },
  "hash": "f9494f14cd5e3c8239fd96ea4275229b866e4b60c3360e77ba7cb805ffe1250b",
  "reader_reviews": [
    {
      "model": "gpt-5.4-nano-2026-03-17",
      "draft_model": "gpt-5.4-2026-03-05",
      "passed": false,
      "reasons": [
        "The packet does not provide a direct definition of the term “dental.”",
        "The definition makes general claims about what “dental” refers to (e.g., oral health care, education, and communication broadly) that are not explicitly supported in the supplied packet text.",
        "The packet is about teledentistry adoption (facilitators/barriers) and mentions “oral healthcare delivery” and “dental care providers,” but it does not justify the specific explanatory scope stated in the definition."
      ],
      "definition_hash": "0e6efc1ea50a46bd8071c9d6ae55e2075f3567905df2bd8d807c0b82c5c66821",
      "packet_hash": "e799a38f74cad7cc3e6f83905eae0b99bfcc43f72a5feb5156bea1858c5148da",
      "published_packet_hash": "e799a38f74cad7cc3e6f83905eae0b99bfcc43f72a5feb5156bea1858c5148da",
      "receipt_id": "441e9e9261c64562b62de8b82d2d8f44",
      "request_hash": "924e0082fd274b702c3b40a29b16da59cc4c35dac49cf9ca1d95e18f99915de5",
      "registration_hash": "73c42cb1b7ea978710e48432560173399e94cf61c745174f0544800d6dd84318"
    },
    {
      "model": "gpt-5.4-mini-2026-03-17",
      "draft_model": "gpt-5.4-2026-03-05",
      "passed": false,
      "reasons": [
        "The packet is about teledentistry and dental care providers, not a dictionary definition of the term “dental,” so the requested sense is not directly supported.",
        "The definition’s claim that “dental” refers to oral health care and to services delivered by dental care professionals is broader than the packet’s scope, which only mentions dental care providers in relation to teledentistry adoption.",
        "The added statement about care, education, and communication related to oral health is an unsupported generalization from the packet."
      ],
      "definition_hash": "0e6efc1ea50a46bd8071c9d6ae55e2075f3567905df2bd8d807c0b82c5c66821",
      "packet_hash": "e799a38f74cad7cc3e6f83905eae0b99bfcc43f72a5feb5156bea1858c5148da",
      "published_packet_hash": "e799a38f74cad7cc3e6f83905eae0b99bfcc43f72a5feb5156bea1858c5148da",
      "receipt_id": "eee0285a39344cd0aaaf851296874f5f",
      "request_hash": "0f6745dc5fd95dbc92e2f72e7d5f8d13a1a498fbf8dbd3b346ecb40526221504",
      "registration_hash": "73c42cb1b7ea978710e48432560173399e94cf61c745174f0544800d6dd84318"
    }
  ]
}
