{
  "id": "fuzzy-trace-theory",
  "term": "fuzzy trace theory",
  "definition": "Fuzzy trace theory is a memory theory proposing that people store two kinds of traces from experience: a detailed, item-specific trace and a more general trace of the meaning. It is used to explain false memories by suggesting that people may later rely on the meaning-based trace, which tends to last longer than the detailed trace.",
  "field": "cognition",
  "also_see": [],
  "aliases": [],
  "sources": [
    "article-pmc8677658"
  ],
  "provenance": [
    {
      "role": "draft_basis",
      "source": "article-pmc8677658",
      "revision": "2021; DOI 10.3389/fpsyg.2021.718818; article XML SHA-256 529eed3538e8336df66697db7e07d915374d19c2a7f012c1a601e2936302a7a5",
      "scope": "Source record 10.3389/fpsyg.2021.718818; pinned source text",
      "locator": "https://doi.org/10.3389/fpsyg.2021.718818"
    }
  ],
  "version": 1,
  "packet_hash": "8a70f39987b14f6bb2abafc7b570e14e94c80376b21449681d16a30f6a298a77",
  "draft_evidence": {
    "model": "gpt-5.4-2026-03-05",
    "receipt_id": "2cafa15d09bb4e308f94287f9104e2ba",
    "request_hash": "7df2a46b3232089d92b9469f91dbb1c46a6c0066d9d09bc041d73a1cae6b2346",
    "registration_hash": "36f5e498dcb61cfe3df520264d01e4052170d6f97730c3d0ec61f0a4c2e7f3d3",
    "definition_hash": "250201ca475614b49c947288bf2200510de443bc0dbdd659fa9d3ebc782ddd19",
    "packet_hash": "8a70f39987b14f6bb2abafc7b570e14e94c80376b21449681d16a30f6a298a77"
  },
  "hash": "9266ae858c2552ce4e9ff4c51514a01bd267b1fba089e1c36b800646bdb31f3c",
  "reader_reviews": [
    {
      "model": "gpt-5.4-mini-2026-03-17",
      "draft_model": "gpt-5.4-2026-03-05",
      "passed": true,
      "reasons": [],
      "definition_hash": "250201ca475614b49c947288bf2200510de443bc0dbdd659fa9d3ebc782ddd19",
      "packet_hash": "8a70f39987b14f6bb2abafc7b570e14e94c80376b21449681d16a30f6a298a77",
      "published_packet_hash": "8a70f39987b14f6bb2abafc7b570e14e94c80376b21449681d16a30f6a298a77",
      "receipt_id": "b552324e12ad4af4829c8f9aa017e283",
      "request_hash": "3d498bd90c265dff581f9833128a51ddc330a5eb6cb442c0ba5dda38d52d2204",
      "registration_hash": "a868d117e7d302259a8d3442c2c1530a5f584b83576680a6026638717deb7114"
    },
    {
      "model": "gpt-5.4-nano-2026-03-17",
      "draft_model": "gpt-5.4-2026-03-05",
      "passed": false,
      "reasons": [
        "The packet states that false memories in the DRM paradigm result from gist formation during encoding and that gist decays more slowly than verbatim memory, but it does not explicitly support the wording that “people may later rely on the meaning-based trace.”"
      ],
      "definition_hash": "250201ca475614b49c947288bf2200510de443bc0dbdd659fa9d3ebc782ddd19",
      "packet_hash": "8a70f39987b14f6bb2abafc7b570e14e94c80376b21449681d16a30f6a298a77",
      "published_packet_hash": "8a70f39987b14f6bb2abafc7b570e14e94c80376b21449681d16a30f6a298a77",
      "receipt_id": "6a6875a3e4ce400293b9527c2b35592a",
      "request_hash": "a076a79def42cb8a94e48d3942f93b88dc8f4950b7dc49583c65ff9b0c472b94",
      "registration_hash": "a868d117e7d302259a8d3442c2c1530a5f584b83576680a6026638717deb7114"
    }
  ],
  "external_review": {
    "batch": "claude-tiebreak-2026-10-18",
    "manifest_sha256": "1895b37c6cfc8bcc92612215f67cee23e8b8875d822d42063922d62a8b57dd58"
  }
}
