{
  "id": "collective-behavior",
  "term": "collective behavior",
  "definition": "Collective behavior is the behavior of a group of people that seems unified in their attitudes, feelings, and motivations. It refers to an aggregate acting as though its members share a common direction.",
  "field": "learning",
  "also_see": [],
  "aliases": [],
  "sources": [
    "mesh-2026"
  ],
  "provenance": [
    {
      "role": "draft_basis",
      "source": "mesh-2026",
      "revision": "2026 descriptor edition",
      "scope": "Source record D008399; pinned source text",
      "locator": "https://meshb.nlm.nih.gov/record/ui?ui=D008399"
    }
  ],
  "version": 1,
  "packet_hash": "2f2f688a37622348e906a9eb8a468c9c963e56d2794cd59f1017154ce273ef81",
  "draft_evidence": {
    "model": "gpt-5.4-2026-03-05",
    "receipt_id": "fa12d9d647444398a5e831f225ebc6f9",
    "request_hash": "224bf07a552acec4b35fe235826a10b4f99a3e5f6b48971aba95ddc63b61dbbb",
    "registration_hash": "ccf30c2b50e89ba708861f3f1f3da783e9b04d822e3a8e481728b41b9421bcc1",
    "definition_hash": "1a1363c6127ff4a8e80f89b1c8af1bc60f260552fc155614175ad0ae58e2cc2a",
    "packet_hash": "2f2f688a37622348e906a9eb8a468c9c963e56d2794cd59f1017154ce273ef81"
  },
  "hash": "792e104e413a1244062dab0d5a8c5e00f69f2f6fc2579f3d12e79229fe4209db"
}
