{
  "id": "regimen",
  "term": "regimen",
  "definition": "In this mental health context, a regimen is a person’s prescribed psychotropic medication plan or pattern of use. The source also uses the term to highlight that such plans can vary in complexity over time.",
  "field": "counselling skills",
  "also_see": [],
  "aliases": [],
  "sources": [
    "article-pmc13333713"
  ],
  "provenance": [
    {
      "role": "draft_basis",
      "source": "article-pmc13333713",
      "revision": "2026; DOI 10.3389/fpsyt.2026.1841866; article XML SHA-256 8fe8011273fe00f4630a2fe07c4b0e5661e842bede1a0c775af58b2b8fdca375",
      "scope": "Source record 10.3389/fpsyt.2026.1841866; pinned source text",
      "locator": "https://doi.org/10.3389/fpsyt.2026.1841866"
    }
  ],
  "version": 1,
  "packet_hash": "744db371f995edecc9d9889168c465af28fbe978cab96ee951a2caf40cf30402",
  "draft_evidence": {
    "model": "gpt-5.4-2026-03-05",
    "receipt_id": "047abaa2b4924f09a45748a32bbce193",
    "request_hash": "3dab1dacf88da180e7ff8074dcc7a132295bce74f464936e84f8a5ac8427b998",
    "registration_hash": "4ed013ab52ed87515f6842cbec110fef45588e8fcada34dbb420e9458ebcf230",
    "definition_hash": "16d7d6eea7bccaa0972c316332f0f5cd99e5f19c06865d71eb2b4c714eddb087",
    "packet_hash": "744db371f995edecc9d9889168c465af28fbe978cab96ee951a2caf40cf30402"
  },
  "hash": "c5aa241772ebe677a3016d189563aa6e001c4d71fc8b430cc20feb79c4a8a725",
  "reader_reviews": [
    {
      "model": "gpt-5.4-mini-2026-03-17",
      "draft_model": "gpt-5.4-2026-03-05",
      "passed": false,
      "reasons": [
        "The packet supports that “regimen” is used in the phrase “regimen complexity” in mental health care, but it does not define regimen as a person’s prescribed psychotropic medication plan or pattern of use.",
        "The claim that such plans “can vary in complexity over time” adds an unsupported time-related generalization; the source only mentions concerns about regimen complexity.",
        "The definition is more specific than the packet supports and reads like a medical-drug usage definition rather than a term established by this source in counselling skills."
      ],
      "definition_hash": "16d7d6eea7bccaa0972c316332f0f5cd99e5f19c06865d71eb2b4c714eddb087",
      "packet_hash": "744db371f995edecc9d9889168c465af28fbe978cab96ee951a2caf40cf30402",
      "published_packet_hash": "744db371f995edecc9d9889168c465af28fbe978cab96ee951a2caf40cf30402",
      "receipt_id": "4a048bf4e0e94c80ba6e4e9c29fa5808",
      "request_hash": "5aabc5cd9d1475fee750ee0945da5bd56157c0a75ffcfba36c67cd48b9ffedc2",
      "registration_hash": "6e360761531d7665c7ad2525ebc2708a3d8f7362e3388c6161407596fd641c01"
    },
    {
      "model": "gpt-5.4-nano-2026-03-17",
      "draft_model": "gpt-5.4-2026-03-05",
      "passed": false,
      "reasons": [
        "The packet text does not define “regimen” as a person’s prescribed psychotropic medication plan or pattern of use; it only mentions “regimen complexity” in the context of concerns about prescribing.",
        "The packet provides no support for the claim that such plans can vary in complexity over time.",
        "The definition includes additional specifics (“prescribed psychotropic medication plan or pattern of use”) that are not explicitly stated or paraphrasable from the provided packet excerpt."
      ],
      "definition_hash": "16d7d6eea7bccaa0972c316332f0f5cd99e5f19c06865d71eb2b4c714eddb087",
      "packet_hash": "744db371f995edecc9d9889168c465af28fbe978cab96ee951a2caf40cf30402",
      "published_packet_hash": "744db371f995edecc9d9889168c465af28fbe978cab96ee951a2caf40cf30402",
      "receipt_id": "b9be5ee86245404aa762161f8980708a",
      "request_hash": "eb881d66fc60cb350c29bdcfe43ad783ab002f644653fde41c37c42780000846",
      "registration_hash": "6e360761531d7665c7ad2525ebc2708a3d8f7362e3388c6161407596fd641c01"
    }
  ]
}
