{
  "id": "otoneurology",
  "term": "otoneurology",
  "definition": "Otoneurology is a subspecialty of otolaryngology focused on the parts of the nervous system that are related to the ear.",
  "field": "biological",
  "also_see": [],
  "aliases": [],
  "sources": [
    "mesh-2026"
  ],
  "provenance": [
    {
      "role": "draft_basis",
      "source": "mesh-2026",
      "revision": "2026 descriptor edition",
      "scope": "Source record D063165; pinned source text",
      "locator": "https://meshb.nlm.nih.gov/record/ui?ui=D063165"
    }
  ],
  "version": 1,
  "packet_hash": "37a84b6c4d9fc9032e539d1026e6e0b6ff3082f575c5ba24bae454f46502913b",
  "draft_evidence": {
    "model": "gpt-5.4-2026-03-05",
    "receipt_id": "249db4bd7a9844858f05c7424122c927",
    "request_hash": "78252e8cd8ff6e1c62f24c5de1386f62fb543bc3c869d4857226508b685f7b36",
    "registration_hash": "ccf30c2b50e89ba708861f3f1f3da783e9b04d822e3a8e481728b41b9421bcc1",
    "definition_hash": "39e34e2296756ecfd0e8f0864a9302b274172897dab1163d87e9caf4acfbfc82",
    "packet_hash": "37a84b6c4d9fc9032e539d1026e6e0b6ff3082f575c5ba24bae454f46502913b"
  },
  "hash": "4e4ca922e396932322c8c05ed021a20bdb3480d3340b1d0c7ac9c50ef7e62d23"
}
