{
  "id": "incidental-memory",
  "term": "incidental memory",
  "definition": "Incidental memory is memory for information or objects that were encountered without deliberately trying to learn or remember them. In this packet, it refers to later recognition of real-world objects noticed while moving through an everyday setting.",
  "field": "cognition",
  "also_see": [],
  "aliases": [],
  "sources": [
    "article-pmc4062423"
  ],
  "provenance": [
    {
      "role": "draft_basis",
      "source": "article-pmc4062423",
      "revision": "2014; DOI 10.1371/journal.pone.0099051; article XML SHA-256 05fcc877d7aa7f7bf31bb8c1a52bd670918980c989c45f301d6da7ed5423f011",
      "scope": "Source record 10.1371/journal.pone.0099051; pinned source text",
      "locator": "https://doi.org/10.1371/journal.pone.0099051"
    }
  ],
  "version": 1,
  "packet_hash": "dd91fa6c9ae571243cd0db27ad70b05f2e5c16c164df0f11b5e195c5d0275659",
  "draft_evidence": {
    "model": "gpt-5.4-2026-03-05",
    "receipt_id": "63e71ee7da634552b432c193f67c7442",
    "request_hash": "2951895523e338b81d34098a5f1c7965587a6e1d8f75d1c756a2051ed22c83e1",
    "registration_hash": "c57989f3fbb5d448687075c46c328c2495dfc9d8fed88acfa5c6b0d69a91e974",
    "definition_hash": "ef070e3671128132225650638215e5cdd16a1c91d8d54afd736137b30e91219d",
    "packet_hash": "dd91fa6c9ae571243cd0db27ad70b05f2e5c16c164df0f11b5e195c5d0275659"
  },
  "hash": "80a589f5df5c2694e98c4e23fb73c08bb83defb1fddb14017dd6797bb9f86cf6",
  "reader_reviews": [
    {
      "model": "gpt-5.4-mini-2026-03-17",
      "draft_model": "gpt-5.4-2026-03-05",
      "passed": false,
      "reasons": [
        "The packet supports incidental memory in the context of later recognition of real-world objects encountered in a conference-room traversal, but it does not explicitly support the broader gloss that it is memory for information or objects encountered without deliberately trying to learn or remember them.",
        "“Everyday setting” is an unsupported generalization from the packet’s specific conference-room context."
      ],
      "definition_hash": "ef070e3671128132225650638215e5cdd16a1c91d8d54afd736137b30e91219d",
      "packet_hash": "dd91fa6c9ae571243cd0db27ad70b05f2e5c16c164df0f11b5e195c5d0275659",
      "published_packet_hash": "dd91fa6c9ae571243cd0db27ad70b05f2e5c16c164df0f11b5e195c5d0275659",
      "receipt_id": "2dd9b991623646b99469db1f71e899d1",
      "request_hash": "ce65c598604ff145cdea27e28bca9b76280d7ec24f0c997e9990662fd0bcfb01",
      "registration_hash": "73c42cb1b7ea978710e48432560173399e94cf61c745174f0544800d6dd84318"
    },
    {
      "model": "gpt-5.4-nano-2026-03-17",
      "draft_model": "gpt-5.4-2026-03-05",
      "passed": false,
      "reasons": [
        "The definition’s first sentence claims a general meaning: “encountered without deliberately trying to learn or remember them.” The provided packet text discusses “incidental memory” and “incidental memory for real-world objects,” but it does not explicitly state this definition-level criterion about not deliberately trying to learn or remember.",
        "The packet supports that the studied “incidental memory” involves later recognition of real-world objects encountered while moving through an everyday setting (traversing a conference room), but it does not provide enough support for the broader, explicit definitional phrasing used in the first sentence."
      ],
      "definition_hash": "ef070e3671128132225650638215e5cdd16a1c91d8d54afd736137b30e91219d",
      "packet_hash": "dd91fa6c9ae571243cd0db27ad70b05f2e5c16c164df0f11b5e195c5d0275659",
      "published_packet_hash": "dd91fa6c9ae571243cd0db27ad70b05f2e5c16c164df0f11b5e195c5d0275659",
      "receipt_id": "b2da6fccb6eb4c2d9d22f79983fb6158",
      "request_hash": "afe6cf4e7c4ade86caf11d6126c0659d1ba1e44453bb8a2efa0924639149d61f",
      "registration_hash": "73c42cb1b7ea978710e48432560173399e94cf61c745174f0544800d6dd84318"
    }
  ]
}
