{
  "id": "brightness-adaptation",
  "term": "brightness adaptation",
  "definition": "Brightness adaptation is the adjustment of a system to different lighting levels so it can keep working accurately as brightness changes. In this source, it refers to dynamic preprocessing that helps facial-recognition-based driver fatigue detection stay reliable under varying light conditions.",
  "field": "cognition",
  "also_see": [],
  "aliases": [],
  "sources": [
    "article-pmc11236172"
  ],
  "provenance": [
    {
      "role": "draft_basis",
      "source": "article-pmc11236172",
      "revision": "2024; DOI 10.1371/journal.pone.0304669; article XML SHA-256 f92518d0d69904e65215025e119d784bf160f05b1fcea16849bcb338011cf55c",
      "scope": "Source record 10.1371/journal.pone.0304669; pinned source text",
      "locator": "https://doi.org/10.1371/journal.pone.0304669"
    }
  ],
  "version": 1,
  "packet_hash": "a78e5fccffc7159bce93c629e6b59377278b4909fbe815007ef48b06103c66bb",
  "draft_evidence": {
    "model": "gpt-5.4-2026-03-05",
    "receipt_id": "7a8cf1c84bae4d39b61ff08ba904eebd",
    "request_hash": "c4e8fceaea0d8c8e0f0cd67cbcdf9b6eec76c31b38f9a8b7f21f67df8048cda4",
    "registration_hash": "5c490b681daeaf182d38c4329d8d3eef885f9a2af23c9be8197c6f7a3cc13c21",
    "definition_hash": "42dbca02533cc886237e18a3639ecdc6b99780dd4d5a5a67e2a0bae00fa170be",
    "packet_hash": "a78e5fccffc7159bce93c629e6b59377278b4909fbe815007ef48b06103c66bb"
  },
  "hash": "aea8bba186c8fca42377d34379f25e63b74c9229213207338ccaa40a4da020c9",
  "reader_reviews": [
    {
      "model": "gpt-5.4-mini-2026-03-17",
      "draft_model": "gpt-5.4-2026-03-05",
      "passed": true,
      "reasons": [],
      "definition_hash": "42dbca02533cc886237e18a3639ecdc6b99780dd4d5a5a67e2a0bae00fa170be",
      "packet_hash": "a78e5fccffc7159bce93c629e6b59377278b4909fbe815007ef48b06103c66bb",
      "published_packet_hash": "a78e5fccffc7159bce93c629e6b59377278b4909fbe815007ef48b06103c66bb",
      "receipt_id": "3fda0129935a43f9a8631c4cd2667ba0",
      "request_hash": "f84b6fb0e046603ace18f0ad101bb0c3e33ae2d4874605fea51792c0136c005e",
      "registration_hash": "a313e407e9d8a9a0eaa57511447e185aa14baf5f838272b8f2d3aa07d9c4dc6e"
    },
    {
      "model": "gpt-5.4-nano-2026-03-17",
      "draft_model": "gpt-5.4-2026-03-05",
      "passed": false,
      "reasons": [
        "The first sentence makes a broad, general claim (“adjustment of a system … so it can keep working accurately”) that is not explicitly stated in the packet; the packet only describes robustness/improved detection under varying brightness/lighting conditions.",
        "The definition’s framing as “dynamic preprocessing” is only partially supported: the packet mentions “advanced data preprocessing and dynamic brightness adaptation techniques,” but it does not explicitly define brightness adaptation itself as “dynamic preprocessing” in general terms.",
        "The provided packet is about a computer-vision driver fatigue detection method; the definition’s placement in the cognition field is not clearly supported by the packet’s content."
      ],
      "definition_hash": "42dbca02533cc886237e18a3639ecdc6b99780dd4d5a5a67e2a0bae00fa170be",
      "packet_hash": "a78e5fccffc7159bce93c629e6b59377278b4909fbe815007ef48b06103c66bb",
      "published_packet_hash": "a78e5fccffc7159bce93c629e6b59377278b4909fbe815007ef48b06103c66bb",
      "receipt_id": "496c29012a7b47899a450929aa7c6476",
      "request_hash": "42700339df339f0e6540e825c0df4cf018e2f8df784a84b9d29fa4401c115537",
      "registration_hash": "a313e407e9d8a9a0eaa57511447e185aa14baf5f838272b8f2d3aa07d9c4dc6e"
    }
  ],
  "external_review": {
    "batch": "claude-tiebreak-2026-10-18",
    "manifest_sha256": "1895b37c6cfc8bcc92612215f67cee23e8b8875d822d42063922d62a8b57dd58"
  }
}
