{
  "id": "amoxapine",
  "term": "amoxapine",
  "definition": "Amoxapine is a medication used to treat depression. It affects brain signaling by reducing the reuptake of norepinephrine and serotonin and also blocks dopamine receptors.",
  "field": "biological",
  "also_see": [],
  "aliases": [],
  "sources": [
    "mesh-2026"
  ],
  "provenance": [
    {
      "role": "draft_basis",
      "source": "mesh-2026",
      "revision": "2026 descriptor edition",
      "scope": "Source record D000657; pinned source text",
      "locator": "https://meshb.nlm.nih.gov/record/ui?ui=D000657"
    }
  ],
  "version": 1,
  "packet_hash": "c472516fb38e6810ca7c88c9b0d517f512cf1f93d982c26af5f8426b10308124",
  "draft_evidence": {
    "model": "gpt-5.4-2026-03-05",
    "receipt_id": "4b5b65cec043412083928b79f8be3ebf",
    "request_hash": "798d36cfbd256edeeaff17b44802e382fa8191d8b7357ee39726f24a8118778b",
    "registration_hash": "ccf30c2b50e89ba708861f3f1f3da783e9b04d822e3a8e481728b41b9421bcc1",
    "definition_hash": "462fec232efb51aed9850d2624801950dc383c9ec1b4cc4bf5d23508f996e36c",
    "packet_hash": "c472516fb38e6810ca7c88c9b0d517f512cf1f93d982c26af5f8426b10308124"
  },
  "hash": "7adb65c44e2ec749e7662c23ae4252d6d0b6bba0e31b55abc211f3aead8b694d",
  "reader_reviews": [
    {
      "model": "gpt-5.4-nano-2026-03-17",
      "draft_model": "gpt-5.4-2026-03-05",
      "passed": true,
      "reasons": [],
      "definition_hash": "462fec232efb51aed9850d2624801950dc383c9ec1b4cc4bf5d23508f996e36c",
      "packet_hash": "c472516fb38e6810ca7c88c9b0d517f512cf1f93d982c26af5f8426b10308124",
      "published_packet_hash": "c472516fb38e6810ca7c88c9b0d517f512cf1f93d982c26af5f8426b10308124",
      "receipt_id": "fdb1d5fe49b24aae86763f7a4ae1b224",
      "request_hash": "6d4aed46f13797564fe64c7102d1cdd15f6c70de9e61318c58c5d3fe63bc96f3",
      "registration_hash": "7e82aff66f337c6fe5d7ddbbe9cb4c76ece07a01379e2e612f5d8f6ea3b4e7f8"
    },
    {
      "model": "gpt-5.4-mini-2026-03-17",
      "draft_model": "gpt-5.4-2026-03-05",
      "passed": true,
      "reasons": [],
      "definition_hash": "462fec232efb51aed9850d2624801950dc383c9ec1b4cc4bf5d23508f996e36c",
      "packet_hash": "c472516fb38e6810ca7c88c9b0d517f512cf1f93d982c26af5f8426b10308124",
      "published_packet_hash": "c472516fb38e6810ca7c88c9b0d517f512cf1f93d982c26af5f8426b10308124",
      "receipt_id": "ac0a55017079434a8d9c7a17876a4028",
      "request_hash": "7ae641c647691d0dfd277cef4c1a748b75d981d1eb4f8ca39059a56a51780af9",
      "registration_hash": "7e82aff66f337c6fe5d7ddbbe9cb4c76ece07a01379e2e612f5d8f6ea3b4e7f8"
    }
  ]
}
